{
  "schema": "fmea-mining.causal-levels.v1",
  "version": "1.3.12",
  "purpose": "Separar fenômeno, mecanismo imediato, fatores contribuintes e causa raiz sistêmica candidata, sem atribuir evento ou aprovação.",
  "sourceBasis": [
    "data/knowledge/causal-chains.v1.json",
    "data/quality/diagnostic-pathways.v1.json",
    "data/knowledge/causal-effects.v1.json"
  ],
  "policy": {
    "rootCausesRequireIndependentEvidence": true,
    "operationalEffectNotAutomaticallyObserved": true,
    "preventOrganizationalBlameWithoutInvestigation": true,
    "unknownOemEffectivityMustRemainNull": true,
    "sourceScopeOnlyGeneralPrinciples": true
  },
  "records": [
    {
      "chainId": "FC-HOSE-001",
      "family": "mangueiras_hidraulicas",
      "operatingFunction": "Conduzir fluido pressurizado sem vazamento e mantendo resistência mecânica",
      "functionalFailureId": "FF-06",
      "causalLevels": {
        "observedPhenomenon": "Abrasão e/ou vestígio de fluido na região da mangueira — ainda não observado neste banco.",
        "immediatePhysicalMechanismCandidate": "Perda localizada de contenção ou simples transporte externo de óleo; a posição de origem ainda precisa ser comprovada.",
        "contributingConditionCandidates": [
          "Roteamento em contato com estrutura",
          "Falta ou posicionamento inadequado de proteção",
          "Vazamento em peça acima da mangueira"
        ],
        "rootCauseCandidates": [
          "Deficiência de controle de roteamento na montagem",
          "Falha de verificação da origem após intervenções anteriores"
        ],
        "rootCauseNotEstablishedBecause": "Não existem evidências de implementação de procedimento, ordem de serviço de montagem, desvio de padrão ou origem confirmada."
      },
      "localEffectReference": {
        "chainId": "FC-HOSE-001",
        "sourceFile": "data/knowledge/causal-effects.v1.json",
        "status": "possible_unobserved"
      },
      "evidenceRequirementIds": [
        "ER-FC-HOSE-001-I1",
        "ER-FC-HOSE-001-I2"
      ],
      "sourceIds": [
        "CAT-HYD-HOSE-INSPECT",
        "CAT-HYD-HOSE-FAILURE"
      ],
      "editorialOrigin": "preservado_do_roteiro_v1.3.11",
      "sourceScope": "principios_gerais_nao_efetividade_oem",
      "applicability": {
        "modelId": null,
        "locationId": null,
        "componentCode": null,
        "serialOrArrangement": null
      },
      "observation": {
        "hasObservedEvent": false,
        "observedValue": null,
        "observedAt": null
      },
      "review": {
        "status": "inferido_com_literatura_geral",
        "reviewer": null,
        "independentReviewer": null,
        "decision": null
      },
      "claimStatus": "hipotese_tecnica_nao_homologada",
      "confirmedRootCause": false,
      "measuredSeverity": null
    },
    {
      "chainId": "FC-HOSE-002",
      "family": "mangueiras_hidraulicas",
      "operatingFunction": "Transportar fluido pressurizado durante movimentos do equipamento",
      "functionalFailureId": "FF-06",
      "causalLevels": {
        "observedPhenomenon": "Trajeto de mangueira com torção, curva acentuada ou fissura aparente; nenhuma inconformidade real foi medida.",
        "immediatePhysicalMechanismCandidate": "Solicitações repetidas de flexão/torção podem degradar cobertura e reforço até perda de integridade, se fora do arranjo aplicável.",
        "contributingConditionCandidates": [
          "Raio de curvatura ou comprimento inadequados",
          "Torção de montagem",
          "Esforço cíclico durante movimento do implemento"
        ],
        "rootCauseCandidates": [
          "Controle de projeto/roteamento inadequado — investigar somente com desenho efetivo e histórico de alterações.",
          "Verificação de montagem ou proteção insuficiente — investigar evidências de instalação e inspeções anteriores."
        ],
        "rootCauseNotEstablishedBecause": "Raio mínimo, movimento real, posição da mangueira, desenho de montagem e origem de eventual fuga não foram verificados."
      },
      "localEffectReference": {
        "chainId": "FC-HOSE-002",
        "sourceFile": "data/knowledge/causal-effects.v1.json",
        "status": "possible_unobserved"
      },
      "evidenceRequirementIds": [
        "ER-FC-HOSE-002-I1",
        "ER-FC-HOSE-002-I2"
      ],
      "sourceIds": [
        "CAT-HYD-HOSE-INSPECT"
      ],
      "editorialOrigin": "analise_mecanistica_ampliada_v1.3.12",
      "sourceScope": "principios_gerais_nao_efetividade_oem",
      "applicability": {
        "modelId": null,
        "locationId": null,
        "componentCode": null,
        "serialOrArrangement": null
      },
      "observation": {
        "hasObservedEvent": false,
        "observedValue": null,
        "observedAt": null
      },
      "review": {
        "status": "inferido_com_literatura_geral",
        "reviewer": null,
        "independentReviewer": null,
        "decision": null
      },
      "claimStatus": "hipotese_tecnica_nao_homologada",
      "confirmedRootCause": false,
      "measuredSeverity": null
    },
    {
      "chainId": "FC-HOSE-003",
      "family": "mangueiras_hidraulicas",
      "operatingFunction": "Conter fluido nos terminais sob regime nominal",
      "functionalFailureId": "FF-06",
      "causalLevels": {
        "observedPhenomenon": "Indício de óleo em terminal/adaptador de mangueira ou desacoplamento suspeito, ainda não localizado em máquina real.",
        "immediatePhysicalMechanismCandidate": "Interface mangueira–terminal ou outra conexão pode perder estanqueidade por retenção/vedação comprometida.",
        "contributingConditionCandidates": [
          "Prensagem inadequada",
          "Terminal ou vedação incompatível",
          "Montagem/posição incorreta",
          "Perda de retenção"
        ],
        "rootCauseCandidates": [
          "Especificação ou compatibilidade de conjunto terminal–mangueira inadequada — somente após conferir peças/arranjo e requisitos de prensagem.",
          "Falha de controle de montagem/inspeção de conexão — exige registros e evidência de desvio do procedimento."
        ],
        "rootCauseNotEstablishedBecause": "Sem localização da fuga, identificação da interface, histórico de montagem nem confirmação de componente e vedação."
      },
      "localEffectReference": {
        "chainId": "FC-HOSE-003",
        "sourceFile": "data/knowledge/causal-effects.v1.json",
        "status": "possible_unobserved"
      },
      "evidenceRequirementIds": [
        "ER-FC-HOSE-003-I1",
        "ER-FC-HOSE-003-I2"
      ],
      "sourceIds": [
        "CAT-HYD-HOSE-INSPECT",
        "CAT-HYD-HOSE-FAILURE"
      ],
      "editorialOrigin": "analise_mecanistica_ampliada_v1.3.12",
      "sourceScope": "principios_gerais_nao_efetividade_oem",
      "applicability": {
        "modelId": null,
        "locationId": null,
        "componentCode": null,
        "serialOrArrangement": null
      },
      "observation": {
        "hasObservedEvent": false,
        "observedValue": null,
        "observedAt": null
      },
      "review": {
        "status": "inferido_com_literatura_geral",
        "reviewer": null,
        "independentReviewer": null,
        "decision": null
      },
      "claimStatus": "hipotese_tecnica_nao_homologada",
      "confirmedRootCause": false,
      "measuredSeverity": null
    },
    {
      "chainId": "FC-HOSE-004",
      "family": "mangueiras_hidraulicas",
      "operatingFunction": "Reter propriedades de vedação e flexibilidade na temperatura de projeto",
      "functionalFailureId": "FF-06",
      "causalLevels": {
        "observedPhenomenon": "Endurecimento, fissura ou mudança de aparência na cobertura externa de mangueira, apenas como sinal possível.",
        "immediatePhysicalMechanismCandidate": "Exposição térmica pode degradar elastômero e reduzir capacidade mecânica, se houver relação material-temperatura verificável.",
        "contributingConditionCandidates": [
          "Proximidade de superfície quente",
          "Exposição térmica acima da capacidade do conjunto",
          "Proteção térmica ausente/inadequada"
        ],
        "rootCauseCandidates": [
          "Roteamento ou proteção térmica inadequados — confirmar exposição, especificação e condições de projeto.",
          "Revisão insuficiente de compatibilidade do material ao regime — comprovar documentação de seleção e histórico térmico."
        ],
        "rootCauseNotEstablishedBecause": "Não foram medidas temperaturas, duração de exposição, compatibilidade do material nem impacto de ataque químico/abrasão."
      },
      "localEffectReference": {
        "chainId": "FC-HOSE-004",
        "sourceFile": "data/knowledge/causal-effects.v1.json",
        "status": "possible_unobserved"
      },
      "evidenceRequirementIds": [
        "ER-FC-HOSE-004-I1",
        "ER-FC-HOSE-004-I2"
      ],
      "sourceIds": [
        "CAT-HYD-HOSE-INSPECT"
      ],
      "editorialOrigin": "analise_mecanistica_ampliada_v1.3.12",
      "sourceScope": "principios_gerais_nao_efetividade_oem",
      "applicability": {
        "modelId": null,
        "locationId": null,
        "componentCode": null,
        "serialOrArrangement": null
      },
      "observation": {
        "hasObservedEvent": false,
        "observedValue": null,
        "observedAt": null
      },
      "review": {
        "status": "inferido_com_literatura_geral",
        "reviewer": null,
        "independentReviewer": null,
        "decision": null
      },
      "claimStatus": "hipotese_tecnica_nao_homologada",
      "confirmedRootCause": false,
      "measuredSeverity": null
    },
    {
      "chainId": "FC-FD-001",
      "family": "comando_final",
      "operatingFunction": "Transmitir torque pelo conjunto de redução mantendo perdas e desgaste dentro do esperado",
      "functionalFailureId": "FF-02",
      "causalLevels": {